_type,url,date,text,renderedContent,id,user,replyCount,retweetCount,likeCount,quoteCount,conversationId,lang,source,sourceUrl,sourceLabel,outlinks,tcooutlinks,media,retweetedTweet,quotedTweet,inReplyToTweetId,inReplyToUser,mentionedUsers,coordinates,place,hashtags,cashtags
snscrape.modules.twitter.Tweet,https://twitter.com/GovJanetMills/status/1188892171795083267,2019-10-28 18:55:56+00:00,"On Sunday, I welcomed notable authors to read their books to costumed parents and kids at the Blaine House for Halloween. Mary Poppins, my costume inspiration, once said “In every job that must be done, there is an element of fun,” and that’s certainly true as Governor of Maine. https://t.co/JfYRcscoUN","On Sunday, I welcomed notable authors to read their books to costumed parents and kids at the Blaine House for Halloween. Mary Poppins, my costume inspiration, once said “In every job that must be done, there is an element of fun,” and that’s certainly true as Governor of Maine. https://t.co/JfYRcscoUN",1.19E+18,Mills,7,11,116,11,1.19E+18,en,"<a href=""http://twitter.com/download/iphone"" rel=""nofollow"">Twitter for iPhone</a>",http://twitter.com/download/iphone,Twitter for iPhone,,,"[{'_type': 'snscrape.modules.twitter.Photo', 'previewUrl': 'https://pbs.twimg.com/media/EH_LICqXYAABLhY?format=jpg&name=small', 'fullUrl': 'https://pbs.twimg.com/media/EH_LICqXYAABLhY?format=jpg&name=large'}, {'_type': 'snscrape.modules.twitter.Photo', 'previewUrl': 'https://pbs.twimg.com/media/EH_LICoXYAAR_cK?format=jpg&name=small', 'fullUrl': 'https://pbs.twimg.com/media/EH_LICoXYAAR_cK?format=jpg&name=large'}]",,,,,,,,,
snscrape.modules.twitter.Tweet,https://twitter.com/GovJanetMills/status/1187802807421681664,2019-10-25 18:47:12+00:00,"By expanding the network of charging stations, our state is making electric vehicles a reality for more people, helping them save money on fuel costs, and protecting our environment from harmful carbon emissions – a hat-trick for Maine. (2/2)","By expanding the network of charging stations, our state is making electric vehicles a reality for more people, helping them save money on fuel costs, and protecting our environment from harmful carbon emissions – a hat-trick for Maine. (2/2)",1.19E+18,Mills,9,5,35,0,1.19E+18,en,"<a href=""https://mobile.twitter.com"" rel=""nofollow"">Twitter Web App</a>",https://mobile.twitter.com,Twitter Web App,,,,,,1.19E+18,"{'_type': 'snscrape.modules.twitter.User', 'username': 'GovJanetMills', 'id': 1083795319027089408, 'displayname': 'Governor Janet Mills', 'description': 'The official tweets of Maine’s 75th Governor, Janet T. Mills. Tweets will be archived.', 'rawDescription': 'The official tweets of Maine’s 75th Governor, Janet T. Mills. Tweets will be archived.', 'descriptionUrls': None, 'verified': True, 'created': '2019-01-11T18:38:34+00:00', 'followersCount': 19823, 'friendsCount': 124, 'statusesCount': 624, 'favouritesCount': 11, 'listedCount': 349, 'mediaCount': 178, 'location': 'Augusta, ME', 'protected': False, 'linkUrl': 'https://www.maine.gov/governor/mills/', 'linkTcourl': 'https://t.co/8XzZHZbNgP', 'profileImageUrl': 'https://pbs.twimg.com/profile_images/1184191196437966848/-1FsAEoB_normal.jpg', 'profileBannerUrl': 'https://pbs.twimg.com/profile_banners/1083795319027089408/1547232140', 'url': 'https://twitter.com/GovJanetMills'}",,,,,
snscrape.modules.twitter.Tweet,https://twitter.com/GovJanetMills/status/1187802764971110400,2019-10-25 18:47:02+00:00,"Today, I officially unveiled a new public-use electric vehicle charging station at the West Gardiner Turnpike Plaza and announced awards to 23 municipalities to install 47 new charging stations across the state for the public. (1/2) https://t.co/7XoHIUC8pL","Today, I officially unveiled a new public-use electric vehicle charging station at the West Gardiner Turnpike Plaza and announced awards to 23 municipalities to install 47 new charging stations across the state for the public. (1/2) https://t.co/7XoHIUC8pL",1.19E+18,Mills,12,9,104,2,1.19E+18,en,"<a href=""https://mobile.twitter.com"" rel=""nofollow"">Twitter Web App</a>",https://mobile.twitter.com,Twitter Web App,,,"[{'_type': 'snscrape.modules.twitter.Photo', 'previewUrl': 'https://pbs.twimg.com/media/EHvsT6BVUAAYlm_?format=jpg&name=small', 'fullUrl': 'https://pbs.twimg.com/media/EHvsT6BVUAAYlm_?format=jpg&name=large'}, {'_type': 'snscrape.modules.twitter.Photo', 'previewUrl': 'https://pbs.twimg.com/media/EHvsT6EUYAAmuwb?format=jpg&name=small', 'fullUrl': 'https://pbs.twimg.com/media/EHvsT6EUYAAmuwb?format=jpg&name=large'}, {'_type': 'snscrape.modules.twitter.Photo', 'previewUrl': 'https://pbs.twimg.com/media/EHvsT6EUYAEe2IC?format=jpg&name=small', 'fullUrl': 'https://pbs.twimg.com/media/EHvsT6EUYAEe2IC?format=jpg&name=large'}]",,,,,,,,,
snscrape.modules.twitter.Tweet,https://twitter.com/GovJanetMills/status/1187048025119580166,2019-10-23 16:47:58+00:00,"Today I signed an Executive Order establishing the Elder Justice Coordinating Partnership to combat elder abuse in Maine. The abuse of vulnerable people, especially our older citizens, is an insidious crime and has no place in Maine. https://t.co/0Uherj2kJD","Today I signed an Executive Order establishing the Elder Justice Coordinating Partnership to combat elder abuse in Maine. The abuse of vulnerable people, especially our older citizens, is an insidious crime and has no place in Maine. https://t.co/0Uherj2kJD",1.19E+18,Mills,12,9,63,4,1.19E+18,en,"<a href=""http://twitter.com/download/iphone"" rel=""nofollow"">Twitter for iPhone</a>",http://twitter.com/download/iphone,Twitter for iPhone,,,"[{'_type': 'snscrape.modules.twitter.Photo', 'previewUrl': 'https://pbs.twimg.com/media/EHk94avUYAA_EDV?format=jpg&name=small', 'fullUrl': 'https://pbs.twimg.com/media/EHk94avUYAA_EDV?format=jpg&name=large'}]",,,,,,,,,
snscrape.modules.twitter.Tweet,https://twitter.com/GovJanetMills/status/1186694639232995335,2019-10-22 17:23:44+00:00,"I joined the First Amendment Museum &amp; the Kennebec Valley Garden Club to plant daffodils at the Blaine House Sunday, which will bloom next spring on the anniversary of women’s suffrage — a fitting tribute to the women &amp; men who began that long road towards equal rights for all. https://t.co/wXPUweg3lS","I joined the First Amendment Museum &amp; the Kennebec Valley Garden Club to plant daffodils at the Blaine House Sunday, which will bloom next spring on the anniversary of women’s suffrage — a fitting tribute to the women &amp; men who began that long road towards equal rights for all. https://t.co/wXPUweg3lS",1.19E+18,Mills,3,5,41,0,1.19E+18,en,"<a href=""http://twitter.com/download/iphone"" rel=""nofollow"">Twitter for iPhone</a>",http://twitter.com/download/iphone,Twitter for iPhone,,,"[{'_type': 'snscrape.modules.twitter.Photo', 'previewUrl': 'https://pbs.twimg.com/media/EHf8e6yW4AI3g0N?format=jpg&name=small', 'fullUrl': 'https://pbs.twimg.com/media/EHf8e6yW4AI3g0N?format=jpg&name=large'}, {'_type': 'snscrape.modules.twitter.Photo', 'previewUrl': 'https://pbs.twimg.com/media/EHf8e60XkAEkiws?format=jpg&name=small', 'fullUrl': 'https://pbs.twimg.com/media/EHf8e60XkAEkiws?format=jpg&name=large'}]",,,,,,,,,
snscrape.modules.twitter.Tweet,https://twitter.com/GovJanetMills/status/1185303353242390529,2019-10-18 21:15:15+00:00,I have issued an emergency proclamation granting utilities the flexibility needed to help restore power to Maine people as soon as possible. https://t.co/cnLhhFpFeY,I have issued an emergency proclamation granting utilities the flexibility needed to help restore power to Maine people as soon as possible. https://t.co/cnLhhFpFeY,1.19E+18,Mills,4,4,25,3,1.19E+18,en,"<a href=""http://twitter.com/download/iphone"" rel=""nofollow"">Twitter for iPhone</a>",http://twitter.com/download/iphone,Twitter for iPhone,,,"[{'_type': 'snscrape.modules.twitter.Photo', 'previewUrl': 'https://pbs.twimg.com/media/EHMLHZoWsAENlOY?format=jpg&name=small', 'fullUrl': 'https://pbs.twimg.com/media/EHMLHZoWsAENlOY?format=jpg&name=large'}]",,,,,,,,,
snscrape.modules.twitter.Tweet,https://twitter.com/GovJanetMills/status/1185288453023588352,2019-10-18 20:16:03+00:00,"Caribou-native @Astro_Jessica just took one big step for women and one giant leap for Maine by completing the first all-female spacewalk in history today. Congratulations on this incredible milestone, Jessica, and thank you for inspiring us all. Our state is so proud of you. https://t.co/iEpA9loZX2","Caribou-native @Astro_Jessica just took one big step for women and one giant leap for Maine by completing the first all-female spacewalk in history today. Congratulations on this incredible milestone, Jessica, and thank you for inspiring us all. Our state is so proud of you. twitter.com/Space_Station/…",1.19E+18,Mills,2,25,151,2,1.19E+18,en,"<a href=""http://twitter.com/download/iphone"" rel=""nofollow"">Twitter for iPhone</a>",http://twitter.com/download/iphone,Twitter for iPhone,['https://twitter.com/Space_Station/status/1185271239113428992'],['https://t.co/iEpA9loZX2'],,,"{'_type': 'snscrape.modules.twitter.Tweet', 'url': 'https://twitter.com/Space_Station/status/1185271239113428992', 'date': '2019-10-18T19:07:39+00:00', 'content': '.@Astro_Christina and @Astro_Jessica completed the first #AllWomanSpacewalk today at 2:55pm ET successfully replacing a failed power controller with a spare that is now activated and charging a new lithium-ion battery. Read more... https://t.co/fh3tOCMIVH https://t.co/x5HqvHNaCn', 'renderedContent': '.@Astro_Christina and @Astro_Jessica completed the first #AllWomanSpacewalk today at 2:55pm ET successfully replacing a failed power controller with a spare that is now activated and charging a new lithium-ion battery. Read more... go.nasa.gov/35Ifdgp https://t.co/x5HqvHNaCn', 'id': 1185271239113428992, 'user': {'_type': 'snscrape.modules.twitter.User', 'username': 'Space_Station', 'id': 1451773004, 'displayname': 'International Space Station', 'description': ""NASA's page for updates from the International Space Station, the world-class lab orbiting Earth 250 miles above. For the latest research, follow @ISS_Research."", 'rawDescription': ""NASA's page for updates from the International Space Station, the world-class lab orbiting Earth 250 miles above. For the latest research, follow @ISS_Research."", 'descriptionUrls': None, 'verified': True, 'created': '2013-05-23T15:25:28+00:00', 'followersCount': 5335295, 'friendsCount': 222, 'statusesCount': 14842, 'favouritesCount': 20395, 'listedCount': 14345, 'mediaCount': 6948, 'location': 'Low Earth Orbit', 'protected': False, 'linkUrl': 'http://www.nasa.gov/station', 'linkTcourl': 'https://t.co/9Gk2H0gekn', 'profileImageUrl': 'https://pbs.twimg.com/profile_images/1189945624583720960/k6MtoeIt_normal.jpg', 'profileBannerUrl': 'https://pbs.twimg.com/profile_banners/1451773004/1572540103', 'url': 'https://twitter.com/Space_Station'}, 'replyCount': 60, 'retweetCount': 1013, 'likeCount': 4039, 'quoteCount': 166, 'conversationId': 1185271239113428992, 'lang': 'en', 'source': '<a href=""https://mobile.twitter.com"" rel=""nofollow"">Twitter Web App</a>', 'sourceUrl': 'https://mobile.twitter.com', 'sourceLabel': 'Twitter Web App', 'outlinks': ['https://go.nasa.gov/35Ifdgp'], 'tcooutlinks': ['https://t.co/fh3tOCMIVH'], 'media': [{'_type': 'snscrape.modules.twitter.Photo', 'previewUrl': 'https://pbs.twimg.com/media/EHLt6HPXkAE1c_O?format=jpg&name=small', 'fullUrl': 'https://pbs.twimg.com/media/EHLt6HPXkAE1c_O?format=jpg&name=large'}], 'retweetedTweet': None, 'quotedTweet': None, 'inReplyToTweetId': None, 'inReplyToUser': None, 'mentionedUsers': [{'_type': 'snscrape.modules.twitter.User', 'username': 'Astro_Christina', 'id': 3404297319, 'displayname': 'Christina H Koch', 'description': None, 'rawDescription': None, 'descriptionUrls': None, 'verified': None, 'created': None, 'followersCount': None, 'friendsCount': None, 'statusesCount': None, 'favouritesCount': None, 'listedCount': None, 'mediaCount': None, 'location': None, 'protected': None, 'linkUrl': None, 'linkTcourl': None, 'profileImageUrl': None, 'profileBannerUrl': None, 'url': 'https://twitter.com/Astro_Christina'}, {'_type': 'snscrape.modules.twitter.User', 'username': 'Astro_Jessica', 'id': 1524976560, 'displayname': 'Jessica Meir', 'description': None, 'rawDescription': None, 'descriptionUrls': None, 'verified': None, 'created': None, 'followersCount': None, 'friendsCount': None, 'statusesCount': None, 'favouritesCount': None, 'listedCount': None, 'mediaCount': None, 'location': None, 'protected': None, 'linkUrl': None, 'linkTcourl': None, 'profileImageUrl': None, 'profileBannerUrl': None, 'url': 'https://twitter.com/Astro_Jessica'}], 'coordinates': None, 'place': None, 'hashtags': ['AllWomanSpacewalk'], 'cashtags': None}",,,"[{'_type': 'snscrape.modules.twitter.User', 'username': 'Astro_Jessica', 'id': 1524976560, 'displayname': 'Jessica Meir', 'description': None, 'rawDescription': None, 'descriptionUrls': None, 'verified': None, 'created': None, 'followersCount': None, 'friendsCount': None, 'statusesCount': None, 'favouritesCount': None, 'listedCount': None, 'mediaCount': None, 'location': None, 'protected': None, 'linkUrl': None, 'linkTcourl': None, 'profileImageUrl': None, 'profileBannerUrl': None, 'url': 'https://twitter.com/Astro_Jessica'}]",,,,
snscrape.modules.twitter.Tweet,https://twitter.com/GovJanetMills/status/1184895989561212928,2019-10-17 18:16:32+00:00,"In accordance with a directive from the President, I have directed that the United States and State of Maine flags be flown at half-staff statewide immediately through tomorrow, Friday, October 18, 2019 in honor of Congressman Elijah Cummings. https://t.co/vVyUZq0u1O","In accordance with a directive from the President, I have directed that the United States and State of Maine flags be flown at half-staff statewide immediately through tomorrow, Friday, October 18, 2019 in honor of Congressman Elijah Cummings. maine.gov/tools/whatsnew…",1.18E+18,Mills,9,10,71,0,1.18E+18,en,"<a href=""https://mobile.twitter.com"" rel=""nofollow"">Twitter Web App</a>",https://mobile.twitter.com,Twitter Web App,['https://www.maine.gov/tools/whatsnew/index.php?topic=Gov_Flag&id=1651862&v=article2019'],['https://t.co/vVyUZq0u1O'],,,,,,,,,,
snscrape.modules.twitter.Tweet,https://twitter.com/GovJanetMills/status/1184565037513375744,2019-10-16 20:21:27+00:00,I urge all Maine people to be aware of the impending strong winds and rain and to take all appropriate action to prepare and stay safe. https://t.co/QJyKLzKls5,I urge all Maine people to be aware of the impending strong winds and rain and to take all appropriate action to prepare and stay safe. https://t.co/QJyKLzKls5,1.18E+18,Mills,4,24,31,10,1.18E+18,en,"<a href=""https://mobile.twitter.com"" rel=""nofollow"">Twitter Web App</a>",https://mobile.twitter.com,Twitter Web App,,,"[{'_type': 'snscrape.modules.twitter.Photo', 'previewUrl': 'https://pbs.twimg.com/media/EHBrnlmU4AA5Lw4?format=jpg&name=small', 'fullUrl': 'https://pbs.twimg.com/media/EHBrnlmU4AA5Lw4?format=jpg&name=large'}, {'_type': 'snscrape.modules.twitter.Photo', 'previewUrl': 'https://pbs.twimg.com/media/EHBrnlnUcAASz3x?format=jpg&name=small', 'fullUrl': 'https://pbs.twimg.com/media/EHBrnlnUcAASz3x?format=jpg&name=large'}]",,,,,,,,,
snscrape.modules.twitter.Tweet,https://twitter.com/GovJanetMills/status/1184221998869860353,2019-10-15 21:38:20+00:00,I would support that. https://t.co/uPNTowH8Nx,I would support that. twitter.com/NewsProJoe/sta…,1.18E+18,Mills,8,21,281,1,1.18E+18,en,"<a href=""http://twitter.com/download/iphone"" rel=""nofollow"">Twitter for iPhone</a>",http://twitter.com/download/iphone,Twitter for iPhone,['https://twitter.com/NewsProJoe/status/1184201115698696193'],['https://t.co/uPNTowH8Nx'],,,"{'_type': 'snscrape.modules.twitter.Tweet', 'url': 'https://twitter.com/NewsProJoe/status/1184201115698696193', 'date': '2019-10-15T20:15:22+00:00', 'content': 'After seeing how excited @GovJanetMills was to make beer - I think one of Maine\'s local breweries needs to release ""Janet Pils"" ... Thank you for your attention to this important matter. https://t.co/b4af6bcMT6', 'renderedContent': 'After seeing how excited @GovJanetMills was to make beer - I think one of Maine\'s local breweries needs to release ""Janet Pils"" ... Thank you for your attention to this important matter. https://t.co/b4af6bcMT6', 'id': 1184201115698696193, 'user': {'_type': 'snscrape.modules.twitter.User', 'username': 'NewsProJoe', 'id': 56416346, 'displayname': 'Joe', 'description': 'EMMY® & Murrow Award-winning Executive Producer turned Media Relations Director | Formerly at NBC & CBS | Lobster Roll Connoisseur | Opinions belong to my cat', 'rawDescription': 'EMMY® & Murrow Award-winning Executive Producer turned Media Relations Director | Formerly at NBC & CBS | Lobster Roll Connoisseur | Opinions belong to my cat', 'descriptionUrls': None, 'verified': False, 'created': '2009-07-13T16:25:25+00:00', 'followersCount': 3762, 'friendsCount': 671, 'statusesCount': 15754, 'favouritesCount': 37615, 'listedCount': 87, 'mediaCount': 3815, 'location': '', 'protected': False, 'linkUrl': None, 'linkTcourl': None, 'profileImageUrl': 'https://pbs.twimg.com/profile_images/1410042799504961538/lgZMBVyo_normal.jpg', 'profileBannerUrl': 'https://pbs.twimg.com/profile_banners/56416346/1492474223', 'url': 'https://twitter.com/NewsProJoe'}, 'replyCount': 0, 'retweetCount': 6, 'likeCount': 47, 'quoteCount': 2, 'conversationId': 1184201115698696193, 'lang': 'en', 'source': '<a href=""https://mobile.twitter.com"" rel=""nofollow"">Twitter Web App</a>', 'sourceUrl': 'https://mobile.twitter.com', 'sourceLabel': 'Twitter Web App', 'outlinks': None, 'tcooutlinks': None, 'media': [{'_type': 'snscrape.modules.twitter.Photo', 'previewUrl': 'https://pbs.twimg.com/media/EG8gov_WsAEGTbv?format=jpg&name=small', 'fullUrl': 'https://pbs.twimg.com/media/EG8gov_WsAEGTbv?format=jpg&name=large'}], 'retweetedTweet': None, 'quotedTweet': None, 'inReplyToTweetId': None, 'inReplyToUser': None, 'mentionedUsers': [{'_type': 'snscrape.modules.twitter.User', 'username': 'GovJanetMills', 'id': 1083795319027089408, 'displayname': 'Governor Janet Mills', 'description': None, 'rawDescription': None, 'descriptionUrls': None, 'verified': None, 'created': None, 'followersCount': None, 'friendsCount': None, 'statusesCount': None, 'favouritesCount': None, 'listedCount': None, 'mediaCount': None, 'location': None, 'protected': None, 'linkUrl': None, 'linkTcourl': None, 'profileImageUrl': None, 'profileBannerUrl': None, 'url': 'https://twitter.com/GovJanetMills'}], 'coordinates': None, 'place': None, 'hashtags': None, 'cashtags': None}",,,,,,,
snscrape.modules.twitter.Tweet,https://twitter.com/GovJanetMills/status/1184183435314647042,2019-10-15 19:05:06+00:00,Excited to welcome @Celtics new partnership with @MaineRedClaws and their commitment to Portland. The Red Claws are an important part of Maine’s sports community and I look forward to them entertaining our state’s basketball fans for years to come. https://t.co/CysaEeAIMx,Excited to welcome @Celtics new partnership with @MaineRedClaws and their commitment to Portland. The Red Claws are an important part of Maine’s sports community and I look forward to them entertaining our state’s basketball fans for years to come. pressherald.com/2019/10/15/bos…,1.18E+18,Mills,3,15,141,1,1.18E+18,en,"<a href=""https://mobile.twitter.com"" rel=""nofollow"">Twitter Web App</a>",https://mobile.twitter.com,Twitter Web App,['https://www.pressherald.com/2019/10/15/boston-celtics-complete-purchase-of-maine-red-claws/'],['https://t.co/CysaEeAIMx'],,,,,,"[{'_type': 'snscrape.modules.twitter.User', 'username': 'celtics', 'id': 18139461, 'displayname': 'Boston Celtics', 'description': None, 'rawDescription': None, 'descriptionUrls': None, 'verified': None, 'created': None, 'followersCount': None, 'friendsCount': None, 'statusesCount': None, 'favouritesCount': None, 'listedCount': None, 'mediaCount': None, 'location': None, 'protected': None, 'linkUrl': None, 'linkTcourl': None, 'profileImageUrl': None, 'profileBannerUrl': None, 'url': 'https://twitter.com/celtics'}]",,,,
snscrape.modules.twitter.Tweet,https://twitter.com/GovJanetMills/status/1184137622949695488,2019-10-15 16:03:04+00:00,"This morning I joined Sen. Heather Sanborn of Rising Tide Brewing Company and Rep. Mattie Daughtry of Moderation Brewing for the 1st brew of Ratification, a beer celebrating the centennial of Maine’s ratification of the 19th Amendment recognizing women’s right to vote. https://t.co/SyEq8VyEWo","This morning I joined Sen. Heather Sanborn of Rising Tide Brewing Company and Rep. Mattie Daughtry of Moderation Brewing for the 1st brew of Ratification, a beer celebrating the centennial of Maine’s ratification of the 19th Amendment recognizing women’s right to vote. https://t.co/SyEq8VyEWo",1.18E+18,Mills,5,23,128,4,1.18E+18,en,"<a href=""http://twitter.com/download/iphone"" rel=""nofollow"">Twitter for iPhone</a>",http://twitter.com/download/iphone,Twitter for iPhone,,,"[{'_type': 'snscrape.modules.twitter.Photo', 'previewUrl': 'https://pbs.twimg.com/media/EG7m4w2WoAIFnuX?format=jpg&name=small', 'fullUrl': 'https://pbs.twimg.com/media/EG7m4w2WoAIFnuX?format=jpg&name=large'}, {'_type': 'snscrape.modules.twitter.Photo', 'previewUrl': 'https://pbs.twimg.com/media/EG7m4wzXkAMT8b0?format=jpg&name=small', 'fullUrl': 'https://pbs.twimg.com/media/EG7m4wzXkAMT8b0?format=jpg&name=large'}]",,,,,,"{'_type': 'snscrape.modules.twitter.Coordinates', 'longitude': -70.2570909443819, 'latitude': 43.6654312594374}","{'_type': 'snscrape.modules.twitter.Place', 'fullName': 'Rising Tide Brewing Company', 'name': 'Rising Tide Brewing Company', 'type': 'poi', 'country': 'United States', 'countryCode': 'US'}",,
snscrape.modules.twitter.Tweet,https://twitter.com/GovJanetMills/status/1183762703531180033,2019-10-14 15:13:16+00:00,"On Maine’s first Indigenous Peoples’ Day, let us pay tribute to those who were the first stewards of this land we call Maine, celebrate their many contributions to our great state and recommit ourselves to fostering a relationship anchored in mutual trust and respect. (2/2)","On Maine’s first Indigenous Peoples’ Day, let us pay tribute to those who were the first stewards of this land we call Maine, celebrate their many contributions to our great state and recommit ourselves to fostering a relationship anchored in mutual trust and respect. (2/2)",1.18E+18,Mills,10,24,108,1,1.18E+18,en,"<a href=""https://mobile.twitter.com"" rel=""nofollow"">Twitter Web App</a>",https://mobile.twitter.com,Twitter Web App,,,,,,1.18E+18,"{'_type': 'snscrape.modules.twitter.User', 'username': 'GovJanetMills', 'id': 1083795319027089408, 'displayname': 'Governor Janet Mills', 'description': 'The official tweets of Maine’s 75th Governor, Janet T. Mills. Tweets will be archived.', 'rawDescription': 'The official tweets of Maine’s 75th Governor, Janet T. Mills. Tweets will be archived.', 'descriptionUrls': None, 'verified': True, 'created': '2019-01-11T18:38:34+00:00', 'followersCount': 19823, 'friendsCount': 124, 'statusesCount': 624, 'favouritesCount': 11, 'listedCount': 349, 'mediaCount': 178, 'location': 'Augusta, ME', 'protected': False, 'linkUrl': 'https://www.maine.gov/governor/mills/', 'linkTcourl': 'https://t.co/8XzZHZbNgP', 'profileImageUrl': 'https://pbs.twimg.com/profile_images/1184191196437966848/-1FsAEoB_normal.jpg', 'profileBannerUrl': 'https://pbs.twimg.com/profile_banners/1083795319027089408/1547232140', 'url': 'https://twitter.com/GovJanetMills'}",,,,,
snscrape.modules.twitter.Tweet,https://twitter.com/GovJanetMills/status/1183762610707025920,2019-10-14 15:12:54+00:00,"Maine is home to people from many lands, like those with Italian, French and other ancestries, whose contributions we recognize and cherish. Today, our state takes another step forward in building a brighter, more inclusive future by honoring Maine’s tribal communities. (1/2)","Maine is home to people from many lands, like those with Italian, French and other ancestries, whose contributions we recognize and cherish. Today, our state takes another step forward in building a brighter, more inclusive future by honoring Maine’s tribal communities. (1/2)",1.18E+18,Mills,13,26,145,4,1.18E+18,en,"<a href=""https://mobile.twitter.com"" rel=""nofollow"">Twitter Web App</a>",https://mobile.twitter.com,Twitter Web App,,,,,,,,,,,,
