_type,url,date,text,renderedContent,id,user,replyCount,retweetCount,likeCount,quoteCount,conversationId,lang,source,sourceUrl,sourceLabel,outlinks,tcooutlinks,media,retweetedTweet,quotedTweet,inReplyToTweetId,inReplyToUser,mentionedUsers,coordinates,place,hashtags,cashtags
snscrape.modules.twitter.Tweet,https://twitter.com/GovJanetMills/status/1305945071636762625,2020-09-15 19:02:23+00:00,"As @nirav_mainecdc said today during @MEPublicHealth's briefing, we must work hard to maintain our grip on COVID-19. That means wearing our face coverings, maintaining 6 feet of distance, and washing our hands frequently. Together, we can keep Maine safe. https://t.co/gZxaWc96Pe","As @nirav_mainecdc said today during @MEPublicHealth's briefing, we must work hard to maintain our grip on COVID-19. That means wearing our face coverings, maintaining 6 feet of distance, and washing our hands frequently. Together, we can keep Maine safe. twitter.com/newscentermain…",1.31E+18,Mills,50,67,239,7,1.31E+18,en,"<a href=""https://mobile.twitter.com"" rel=""nofollow"">Twitter Web App</a>",https://mobile.twitter.com,Twitter Web App,['https://twitter.com/newscentermaine/status/1305944117495595008'],['https://t.co/gZxaWc96Pe'],,,"{'_type': 'snscrape.modules.twitter.Tweet', 'url': 'https://twitter.com/newscentermaine/status/1305944117495595008', 'date': '2020-09-15T18:58:35+00:00', 'content': 'Maine CDC Director @nirav_mainecdc says Mainers have a window of opportunity to take proper precautions to prevent the spread of COVID-19 before the arrival of flu season. Dr. Shah asks people to “do their part for the state as a whole.” https://t.co/niuEiO4upl', 'renderedContent': 'Maine CDC Director @nirav_mainecdc says Mainers have a window of opportunity to take proper precautions to prevent the spread of COVID-19 before the arrival of flu season. Dr. Shah asks people to “do their part for the state as a whole.” https://t.co/niuEiO4upl', 'id': 1305944117495595008, 'user': {'_type': 'snscrape.modules.twitter.User', 'username': 'newscentermaine', 'id': 16538186, 'displayname': 'NEWS CENTER Maine', 'description': 'Headlines and breaking news from NBC affiliate NEWS CENTER Maine in Portland and Bangor, Maine. Start your tweet with #NEWSCENTERmaine to say hi!', 'rawDescription': 'Headlines and breaking news from NBC affiliate NEWS CENTER Maine in Portland and Bangor, Maine. Start your tweet with #NEWSCENTERmaine to say hi!', 'descriptionUrls': None, 'verified': True, 'created': '2008-10-01T01:17:26+00:00', 'followersCount': 118449, 'friendsCount': 3653, 'statusesCount': 217696, 'favouritesCount': 5750, 'listedCount': 0, 'mediaCount': 47796, 'location': 'Maine, USA', 'protected': False, 'linkUrl': 'http://www.newscentermaine.com', 'linkTcourl': 'https://t.co/4QmB2FbWIq', 'profileImageUrl': 'https://pbs.twimg.com/profile_images/993665581340602369/wKuEzSYY_normal.jpg', 'profileBannerUrl': 'https://pbs.twimg.com/profile_banners/16538186/1624995515', 'url': 'https://twitter.com/newscentermaine'}, 'replyCount': 15, 'retweetCount': 33, 'likeCount': 69, 'quoteCount': 3, 'conversationId': 1305944117495595008, 'lang': 'en', 'source': '<a href=""https://mobile.twitter.com"" rel=""nofollow"">Twitter Web App</a>', 'sourceUrl': 'https://mobile.twitter.com', 'sourceLabel': 'Twitter Web App', 'outlinks': None, 'tcooutlinks': None, 'media': [{'_type': 'snscrape.modules.twitter.Photo', 'previewUrl': 'https://pbs.twimg.com/media/Eh-lGJoWkAMz-Sm?format=jpg&name=small', 'fullUrl': 'https://pbs.twimg.com/media/Eh-lGJoWkAMz-Sm?format=jpg&name=large'}], 'retweetedTweet': None, 'quotedTweet': None, 'inReplyToTweetId': None, 'inReplyToUser': None, 'mentionedUsers': [{'_type': 'snscrape.modules.twitter.User', 'username': 'nirav_mainecdc', 'id': 1208795284718915591, 'displayname': 'Nirav D. Shah', 'description': None, 'rawDescription': None, 'descriptionUrls': None, 'verified': None, 'created': None, 'followersCount': None, 'friendsCount': None, 'statusesCount': None, 'favouritesCount': None, 'listedCount': None, 'mediaCount': None, 'location': None, 'protected': None, 'linkUrl': None, 'linkTcourl': None, 'profileImageUrl': None, 'profileBannerUrl': None, 'url': 'https://twitter.com/nirav_mainecdc'}], 'coordinates': None, 'place': None, 'hashtags': None, 'cashtags': None}",,,"[{'_type': 'snscrape.modules.twitter.User', 'username': 'nirav_mainecdc', 'id': 1208795284718915591, 'displayname': 'Nirav D. Shah', 'description': None, 'rawDescription': None, 'descriptionUrls': None, 'verified': None, 'created': None, 'followersCount': None, 'friendsCount': None, 'statusesCount': None, 'favouritesCount': None, 'listedCount': None, 'mediaCount': None, 'location': None, 'protected': None, 'linkUrl': None, 'linkTcourl': None, 'profileImageUrl': None, 'profileBannerUrl': None, 'url': 'https://twitter.com/nirav_mainecdc'}, {'_type': 'snscrape.modules.twitter.User', 'username': 'MEPublicHealth', 'id': 61562609, 'displayname': 'Maine CDC', 'description': None, 'rawDescription': None, 'descriptionUrls': None, 'verified': None, 'created': None, 'followersCount': None, 'friendsCount': None, 'statusesCount': None, 'favouritesCount': None, 'listedCount': None, 'mediaCount': None, 'location': None, 'protected': None, 'linkUrl': None, 'linkTcourl': None, 'profileImageUrl': None, 'profileBannerUrl': None, 'url': 'https://twitter.com/MEPublicHealth'}]",,,,
snscrape.modules.twitter.Tweet,https://twitter.com/GovJanetMills/status/1304394102033854468,2020-09-11 12:19:23+00:00,"I have directed that the United States and State of Maine flags be flown at half-staff statewide today in honor of the victims and survivors of the September 11, 2001 terrorist attacks. https://t.co/eQWA3eWAm4","I have directed that the United States and State of Maine flags be flown at half-staff statewide today in honor of the victims and survivors of the September 11, 2001 terrorist attacks. https://t.co/eQWA3eWAm4",1.30E+18,Mills,26,27,254,1,1.30E+18,en,"<a href=""https://mobile.twitter.com"" rel=""nofollow"">Twitter Web App</a>",https://mobile.twitter.com,Twitter Web App,,,"[{'_type': 'snscrape.modules.twitter.Photo', 'previewUrl': 'https://pbs.twimg.com/media/EhojZL2X0AcU16S?format=png&name=small', 'fullUrl': 'https://pbs.twimg.com/media/EhojZL2X0AcU16S?format=png&name=large'}]",,,,,,,,,
snscrape.modules.twitter.Tweet,https://twitter.com/GovJanetMills/status/1302989534423117825,2020-09-07 15:18:08+00:00,"Today, let us continue to recognize that when working people thrive, Maine thrives; America thrives. 3/3","Today, let us continue to recognize that when working people thrive, Maine thrives; America thrives. 3/3",1.30E+18,Mills,49,6,81,0,1.30E+18,en,"<a href=""http://twitter.com/download/iphone"" rel=""nofollow"">Twitter for iPhone</a>",http://twitter.com/download/iphone,Twitter for iPhone,,,,,,1.30E+18,"{'_type': 'snscrape.modules.twitter.User', 'username': 'GovJanetMills', 'id': 1083795319027089408, 'displayname': 'Governor Janet Mills', 'description': 'The official tweets of Maine’s 75th Governor, Janet T. Mills. Tweets will be archived.', 'rawDescription': 'The official tweets of Maine’s 75th Governor, Janet T. Mills. Tweets will be archived.', 'descriptionUrls': None, 'verified': True, 'created': '2019-01-11T18:38:34+00:00', 'followersCount': 19823, 'friendsCount': 124, 'statusesCount': 624, 'favouritesCount': 11, 'listedCount': 349, 'mediaCount': 178, 'location': 'Augusta, ME', 'protected': False, 'linkUrl': 'https://www.maine.gov/governor/mills/', 'linkTcourl': 'https://t.co/8XzZHZbNgP', 'profileImageUrl': 'https://pbs.twimg.com/profile_images/1184191196437966848/-1FsAEoB_normal.jpg', 'profileBannerUrl': 'https://pbs.twimg.com/profile_banners/1083795319027089408/1547232140', 'url': 'https://twitter.com/GovJanetMills'}",,,,,
snscrape.modules.twitter.Tweet,https://twitter.com/GovJanetMills/status/1302989470430572551,2020-09-07 15:17:52+00:00,"Unions formed the backbone of our nation – the middle class – &amp; it is their courage, conviction, &amp; strength that has improved the lives &amp; livelihoods of thousands of men &amp; women across this country. 2/","Unions formed the backbone of our nation – the middle class – &amp; it is their courage, conviction, &amp; strength that has improved the lives &amp; livelihoods of thousands of men &amp; women across this country. 2/",1.30E+18,Mills,40,4,77,1,1.30E+18,en,"<a href=""http://twitter.com/download/iphone"" rel=""nofollow"">Twitter for iPhone</a>",http://twitter.com/download/iphone,Twitter for iPhone,,,,,,1.30E+18,"{'_type': 'snscrape.modules.twitter.User', 'username': 'GovJanetMills', 'id': 1083795319027089408, 'displayname': 'Governor Janet Mills', 'description': 'The official tweets of Maine’s 75th Governor, Janet T. Mills. Tweets will be archived.', 'rawDescription': 'The official tweets of Maine’s 75th Governor, Janet T. Mills. Tweets will be archived.', 'descriptionUrls': None, 'verified': True, 'created': '2019-01-11T18:38:34+00:00', 'followersCount': 19823, 'friendsCount': 124, 'statusesCount': 624, 'favouritesCount': 11, 'listedCount': 349, 'mediaCount': 178, 'location': 'Augusta, ME', 'protected': False, 'linkUrl': 'https://www.maine.gov/governor/mills/', 'linkTcourl': 'https://t.co/8XzZHZbNgP', 'profileImageUrl': 'https://pbs.twimg.com/profile_images/1184191196437966848/-1FsAEoB_normal.jpg', 'profileBannerUrl': 'https://pbs.twimg.com/profile_banners/1083795319027089408/1547232140', 'url': 'https://twitter.com/GovJanetMills'}",,,,,
snscrape.modules.twitter.Tweet,https://twitter.com/GovJanetMills/status/1302989291262554120,2020-09-07 15:17:10+00:00,"This Labor Day, let us pay tribute to the generations of hardworking men &amp; woman who, standing in solidarity, fought day in and day out to deliver safer working conditions, higher wages, better health care, &amp; countless other opportunities &amp; protections for themselves &amp; others. 1/","This Labor Day, let us pay tribute to the generations of hardworking men &amp; woman who, standing in solidarity, fought day in and day out to deliver safer working conditions, higher wages, better health care, &amp; countless other opportunities &amp; protections for themselves &amp; others. 1/",1.30E+18,Mills,79,24,264,6,1.30E+18,en,"<a href=""http://twitter.com/download/iphone"" rel=""nofollow"">Twitter for iPhone</a>",http://twitter.com/download/iphone,Twitter for iPhone,,,,,,,,,,,,
snscrape.modules.twitter.Tweet,https://twitter.com/GovJanetMills/status/1296515487249993729,2020-08-20 18:32:34+00:00,"We continue to hope that Congress will step up to provide greater relief to the people and State of Maine. Businesses can apply for a grant beginning tomorrow, August 21, 2020 through September 9, 2020 with awards made in early October. Learn more at https://t.co/nMAMtQQVY2 3/3","We continue to hope that Congress will step up to provide greater relief to the people and State of Maine. Businesses can apply for a grant beginning tomorrow, August 21, 2020 through September 9, 2020 with awards made in early October. Learn more at maine.gov/governor/mills… 3/3",1.30E+18,Mills,64,2,45,3,1.30E+18,en,"<a href=""https://mobile.twitter.com"" rel=""nofollow"">Twitter Web App</a>",https://mobile.twitter.com,Twitter Web App,['https://www.maine.gov/governor/mills/news/governor-mills-launches-200-million-economic-recovery-grant-program-support-maine-small'],['https://t.co/nMAMtQQVY2'],,,,1.30E+18,"{'_type': 'snscrape.modules.twitter.User', 'username': 'GovJanetMills', 'id': 1083795319027089408, 'displayname': 'Governor Janet Mills', 'description': 'The official tweets of Maine’s 75th Governor, Janet T. Mills. Tweets will be archived.', 'rawDescription': 'The official tweets of Maine’s 75th Governor, Janet T. Mills. Tweets will be archived.', 'descriptionUrls': None, 'verified': True, 'created': '2019-01-11T18:38:34+00:00', 'followersCount': 19823, 'friendsCount': 124, 'statusesCount': 624, 'favouritesCount': 11, 'listedCount': 349, 'mediaCount': 178, 'location': 'Augusta, ME', 'protected': False, 'linkUrl': 'https://www.maine.gov/governor/mills/', 'linkTcourl': 'https://t.co/8XzZHZbNgP', 'profileImageUrl': 'https://pbs.twimg.com/profile_images/1184191196437966848/-1FsAEoB_normal.jpg', 'profileBannerUrl': 'https://pbs.twimg.com/profile_banners/1083795319027089408/1547232140', 'url': 'https://twitter.com/GovJanetMills'}",,,,,
snscrape.modules.twitter.Tweet,https://twitter.com/GovJanetMills/status/1296515171972599808,2020-08-20 18:31:19+00:00,"While we know these grants cannot wholly replace or repair the economic damage this pandemic has caused, our mission is to ensure that each dollar has at least a small, direct impact on supporting these businesses and Maine’s economy. 2/","While we know these grants cannot wholly replace or repair the economic damage this pandemic has caused, our mission is to ensure that each dollar has at least a small, direct impact on supporting these businesses and Maine’s economy. 2/",1.30E+18,Mills,63,3,57,0,1.30E+18,en,"<a href=""https://mobile.twitter.com"" rel=""nofollow"">Twitter Web App</a>",https://mobile.twitter.com,Twitter Web App,,,,,,1.30E+18,"{'_type': 'snscrape.modules.twitter.User', 'username': 'GovJanetMills', 'id': 1083795319027089408, 'displayname': 'Governor Janet Mills', 'description': 'The official tweets of Maine’s 75th Governor, Janet T. Mills. Tweets will be archived.', 'rawDescription': 'The official tweets of Maine’s 75th Governor, Janet T. Mills. Tweets will be archived.', 'descriptionUrls': None, 'verified': True, 'created': '2019-01-11T18:38:34+00:00', 'followersCount': 19823, 'friendsCount': 124, 'statusesCount': 624, 'favouritesCount': 11, 'listedCount': 349, 'mediaCount': 178, 'location': 'Augusta, ME', 'protected': False, 'linkUrl': 'https://www.maine.gov/governor/mills/', 'linkTcourl': 'https://t.co/8XzZHZbNgP', 'profileImageUrl': 'https://pbs.twimg.com/profile_images/1184191196437966848/-1FsAEoB_normal.jpg', 'profileBannerUrl': 'https://pbs.twimg.com/profile_banners/1083795319027089408/1547232140', 'url': 'https://twitter.com/GovJanetMills'}",,,,,
snscrape.modules.twitter.Tweet,https://twitter.com/GovJanetMills/status/1296515002992484352,2020-08-20 18:30:39+00:00,"My Administration will do all we can to support Maine’s small businesses through these difficult times. Today, I have announced the Maine Economic Recovery Grant Program to provide $200 million in Federal Coronavirus Relief Funds to provide relief for small businesses. 1/","My Administration will do all we can to support Maine’s small businesses through these difficult times. Today, I have announced the Maine Economic Recovery Grant Program to provide $200 million in Federal Coronavirus Relief Funds to provide relief for small businesses. 1/",1.30E+18,Mills,123,19,241,9,1.30E+18,en,"<a href=""https://mobile.twitter.com"" rel=""nofollow"">Twitter Web App</a>",https://mobile.twitter.com,Twitter Web App,,,,,,,,,,,,
snscrape.modules.twitter.Tweet,https://twitter.com/GovJanetMills/status/1291071798113521664,2020-08-05 18:01:18+00:00,"It is my hope that in the coming months we all take the steps needed to slow the spread of this virus within and among our states and that, eventually, I am able to welcome my fellow governors in person to Maine. 2/2","It is my hope that in the coming months we all take the steps needed to slow the spread of this virus within and among our states and that, eventually, I am able to welcome my fellow governors in person to Maine. 2/2",1.29E+18,Mills,65,3,104,3,1.29E+18,en,"<a href=""https://mobile.twitter.com"" rel=""nofollow"">Twitter Web App</a>",https://mobile.twitter.com,Twitter Web App,,,,,,1.29E+18,"{'_type': 'snscrape.modules.twitter.User', 'username': 'GovJanetMills', 'id': 1083795319027089408, 'displayname': 'Governor Janet Mills', 'description': 'The official tweets of Maine’s 75th Governor, Janet T. Mills. Tweets will be archived.', 'rawDescription': 'The official tweets of Maine’s 75th Governor, Janet T. Mills. Tweets will be archived.', 'descriptionUrls': None, 'verified': True, 'created': '2019-01-11T18:38:34+00:00', 'followersCount': 19823, 'friendsCount': 124, 'statusesCount': 624, 'favouritesCount': 11, 'listedCount': 349, 'mediaCount': 178, 'location': 'Augusta, ME', 'protected': False, 'linkUrl': 'https://www.maine.gov/governor/mills/', 'linkTcourl': 'https://t.co/8XzZHZbNgP', 'profileImageUrl': 'https://pbs.twimg.com/profile_images/1184191196437966848/-1FsAEoB_normal.jpg', 'profileBannerUrl': 'https://pbs.twimg.com/profile_banners/1083795319027089408/1547232140', 'url': 'https://twitter.com/GovJanetMills'}",,,,,
snscrape.modules.twitter.Tweet,https://twitter.com/GovJanetMills/status/1291071685307715585,2020-08-05 18:00:51+00:00,"Today would've opened the 2020 @NatlGovsAssoc 
Summer meeting in Portland, the first time Maine would've hosted the nation’s governors since 1983. While I would've been elated to welcome them, I'm instead sharing a lobster lunch virtually to protect the health of Maine people. 1/ https://t.co/WaNOlLL03t","Today would've opened the 2020 @NatlGovsAssoc 
Summer meeting in Portland, the first time Maine would've hosted the nation’s governors since 1983. While I would've been elated to welcome them, I'm instead sharing a lobster lunch virtually to protect the health of Maine people. 1/ https://t.co/WaNOlLL03t",1.29E+18,Mills,111,21,388,12,1.29E+18,en,"<a href=""https://mobile.twitter.com"" rel=""nofollow"">Twitter Web App</a>",https://mobile.twitter.com,Twitter Web App,,,"[{'_type': 'snscrape.modules.twitter.Photo', 'previewUrl': 'https://pbs.twimg.com/media/EerMnOyUcAEZ2aN?format=jpg&name=small', 'fullUrl': 'https://pbs.twimg.com/media/EerMnOyUcAEZ2aN?format=jpg&name=large'}, {'_type': 'snscrape.modules.twitter.Photo', 'previewUrl': 'https://pbs.twimg.com/media/EerMnO0UEAE7gj3?format=jpg&name=small', 'fullUrl': 'https://pbs.twimg.com/media/EerMnO0UEAE7gj3?format=jpg&name=large'}]",,,,,"[{'_type': 'snscrape.modules.twitter.User', 'username': 'NatlGovsAssoc', 'id': 393615360, 'displayname': 'NGA', 'description': None, 'rawDescription': None, 'descriptionUrls': None, 'verified': None, 'created': None, 'followersCount': None, 'friendsCount': None, 'statusesCount': None, 'favouritesCount': None, 'listedCount': None, 'mediaCount': None, 'location': None, 'protected': None, 'linkUrl': None, 'linkTcourl': None, 'profileImageUrl': None, 'profileBannerUrl': None, 'url': 'https://twitter.com/NatlGovsAssoc'}]",,,,
snscrape.modules.twitter.Tweet,https://twitter.com/GovJanetMills/status/1288906079628189696,2020-07-30 18:35:30+00:00,Learn more about today's announcement here: https://t.co/2pLT5HrO6j 4/4,Learn more about today's announcement here: maine.gov/governor/mills… 4/4,1.29E+18,Mills,43,3,33,1,1.29E+18,en,"<a href=""https://mobile.twitter.com"" rel=""nofollow"">Twitter Web App</a>",https://mobile.twitter.com,Twitter Web App,['https://www.maine.gov/governor/mills/news/governor-mills-mainehousing-expand-rental-relief-program-help-prevent-evictions-counter'],['https://t.co/2pLT5HrO6j'],,,,1.29E+18,"{'_type': 'snscrape.modules.twitter.User', 'username': 'GovJanetMills', 'id': 1083795319027089408, 'displayname': 'Governor Janet Mills', 'description': 'The official tweets of Maine’s 75th Governor, Janet T. Mills. Tweets will be archived.', 'rawDescription': 'The official tweets of Maine’s 75th Governor, Janet T. Mills. Tweets will be archived.', 'descriptionUrls': None, 'verified': True, 'created': '2019-01-11T18:38:34+00:00', 'followersCount': 19823, 'friendsCount': 124, 'statusesCount': 624, 'favouritesCount': 11, 'listedCount': 349, 'mediaCount': 178, 'location': 'Augusta, ME', 'protected': False, 'linkUrl': 'https://www.maine.gov/governor/mills/', 'linkTcourl': 'https://t.co/8XzZHZbNgP', 'profileImageUrl': 'https://pbs.twimg.com/profile_images/1184191196437966848/-1FsAEoB_normal.jpg', 'profileBannerUrl': 'https://pbs.twimg.com/profile_banners/1083795319027089408/1547232140', 'url': 'https://twitter.com/GovJanetMills'}",,,,,
snscrape.modules.twitter.Tweet,https://twitter.com/GovJanetMills/status/1288905860974960640,2020-07-30 18:34:38+00:00,We believe the combination can help renters while also not leaving landlords behind. My Administration will continue to work closely with @Maine_Housing and local agencies across the state to help keep Mainers housed. 3/,We believe the combination can help renters while also not leaving landlords behind. My Administration will continue to work closely with @Maine_Housing and local agencies across the state to help keep Mainers housed. 3/,1.29E+18,Mills,36,4,52,0,1.29E+18,en,"<a href=""https://mobile.twitter.com"" rel=""nofollow"">Twitter Web App</a>",https://mobile.twitter.com,Twitter Web App,,,,,,1.29E+18,"{'_type': 'snscrape.modules.twitter.User', 'username': 'GovJanetMills', 'id': 1083795319027089408, 'displayname': 'Governor Janet Mills', 'description': 'The official tweets of Maine’s 75th Governor, Janet T. Mills. Tweets will be archived.', 'rawDescription': 'The official tweets of Maine’s 75th Governor, Janet T. Mills. Tweets will be archived.', 'descriptionUrls': None, 'verified': True, 'created': '2019-01-11T18:38:34+00:00', 'followersCount': 19823, 'friendsCount': 124, 'statusesCount': 624, 'favouritesCount': 11, 'listedCount': 349, 'mediaCount': 178, 'location': 'Augusta, ME', 'protected': False, 'linkUrl': 'https://www.maine.gov/governor/mills/', 'linkTcourl': 'https://t.co/8XzZHZbNgP', 'profileImageUrl': 'https://pbs.twimg.com/profile_images/1184191196437966848/-1FsAEoB_normal.jpg', 'profileBannerUrl': 'https://pbs.twimg.com/profile_banners/1083795319027089408/1547232140', 'url': 'https://twitter.com/GovJanetMills'}","[{'_type': 'snscrape.modules.twitter.User', 'username': 'Maine_Housing', 'id': 56364560, 'displayname': 'MaineHousing', 'description': None, 'rawDescription': None, 'descriptionUrls': None, 'verified': None, 'created': None, 'followersCount': None, 'friendsCount': None, 'statusesCount': None, 'favouritesCount': None, 'listedCount': None, 'mediaCount': None, 'location': None, 'protected': None, 'linkUrl': None, 'linkTcourl': None, 'profileImageUrl': None, 'profileBannerUrl': None, 'url': 'https://twitter.com/Maine_Housing'}]",,,,
snscrape.modules.twitter.Tweet,https://twitter.com/GovJanetMills/status/1288905657601540096,2020-07-30 18:33:50+00:00,That is why I am dedicating $5 million in federal Coronavirus Relief Funds to the Covid-19 Rental Relief Program to expand rental assistance for Maine people and I am signing an Executive Order continuing expanded time frame protections for renters in the evictions process. 2/,That is why I am dedicating $5 million in federal Coronavirus Relief Funds to the Covid-19 Rental Relief Program to expand rental assistance for Maine people and I am signing an Executive Order continuing expanded time frame protections for renters in the evictions process. 2/,1.29E+18,Mills,11,16,124,1,1.29E+18,en,"<a href=""https://mobile.twitter.com"" rel=""nofollow"">Twitter Web App</a>",https://mobile.twitter.com,Twitter Web App,,,,,,1.29E+18,"{'_type': 'snscrape.modules.twitter.User', 'username': 'GovJanetMills', 'id': 1083795319027089408, 'displayname': 'Governor Janet Mills', 'description': 'The official tweets of Maine’s 75th Governor, Janet T. Mills. Tweets will be archived.', 'rawDescription': 'The official tweets of Maine’s 75th Governor, Janet T. Mills. Tweets will be archived.', 'descriptionUrls': None, 'verified': True, 'created': '2019-01-11T18:38:34+00:00', 'followersCount': 19823, 'friendsCount': 124, 'statusesCount': 624, 'favouritesCount': 11, 'listedCount': 349, 'mediaCount': 178, 'location': 'Augusta, ME', 'protected': False, 'linkUrl': 'https://www.maine.gov/governor/mills/', 'linkTcourl': 'https://t.co/8XzZHZbNgP', 'profileImageUrl': 'https://pbs.twimg.com/profile_images/1184191196437966848/-1FsAEoB_normal.jpg', 'profileBannerUrl': 'https://pbs.twimg.com/profile_banners/1083795319027089408/1547232140', 'url': 'https://twitter.com/GovJanetMills'}",,,,,
snscrape.modules.twitter.Tweet,https://twitter.com/GovJanetMills/status/1288905322971578369,2020-07-30 18:32:30+00:00,"As the Maine Supreme Judicial Court plans to reopen courts next week, and as the federal government appears poised to reduce unemployment benefits, I am concerned that Maine people will face a housing cliff. The last thing people need during a pandemic is to lose their homes. 1/","As the Maine Supreme Judicial Court plans to reopen courts next week, and as the federal government appears poised to reduce unemployment benefits, I am concerned that Maine people will face a housing cliff. The last thing people need during a pandemic is to lose their homes. 1/",1.29E+18,Mills,62,20,169,4,1.29E+18,en,"<a href=""https://mobile.twitter.com"" rel=""nofollow"">Twitter Web App</a>",https://mobile.twitter.com,Twitter Web App,,,,,,,,,,,,
